{
  "$schema": "http://json-schema.org/draft-07/schema#",
  "$id": "https://glosa.example/schema/litreview_manifest.schema.json",
  "title": "glosa literature review manifest",
  "description": "tier: Dr (specified; independently unreviewed). Implements templates/knowledge/litreview_manifest.yaml (S14 literature-review-system, design/S14_literature-review-system.md): ONE manifest per LRS run (one lens-out hypothesis, R2). Frozen at status FROZEN -- a correction is a new manifest version with `supersedes` pointing at the old id. GATE: no lit-review section may be drafted/published for this hypothesis until gate.accuracy_gate is PASS or PASS_WITH_LIMITS. Namespace https://glosa.example/ is a placeholder.",
  "type": "object",
  "$comment": "DECISIONS.md 2026-09-05 (BBL-2026-09-05-122) ratified both prior TODOs at a thin/simplified scope, built this pass: citations[].intake_tier / intake_tier_reason / global_south_exempt (rule22, INTAKE-TIER-UNTIERED) is a WARNING-only thin flag, never a block, per 'foundation.s7.9-intake-tier-flag = thin flag on AACODS-style checklist'. The discovery-loop extension ('foundation.lrs-discovery-loop-extension = optional S14 stage') is built as an optional `candidate_set_stage` object on `search_log.schema.json` (its own home, sibling of `search_mode`) rather than the FOUNDATION_v0.6_PATCH.md §23 draft's heavier `discovery_routing{used, candidate_questions, k_epi_gate_log}` mechanism -- `kernel.lit_gate`'s optional `search_log` parameter reads it (rule25, DISCOVERY-STAGE-ABSENT, WARNING-only, never blocks). TODO(foundation.lrs-discovery-loop-extension): the heavier k_epi-gated candidate-routing mechanism itself (patch §23's own `discovery_routing`/rule25 DISCOVERY-CANDIDATE-UNGATED as a hard error) remains pending-founder (discovery-routing-stage-adoption) and is NOT built this pass -- only the thin optional-stage flag DECISIONS.md actually ratified.",
  "required": ["id", "hypothesis_ref", "search_log_ref", "status", "citations", "diversity_audit", "accuracy", "gate", "human_owner"],
  "additionalProperties": true,
  "properties": {
    "id": { "type": "string", "pattern": "^litrev-[a-z0-9-]+-[0-9]{3}$" },
    "hypothesis_ref": { "type": "string", "minLength": 1 },
    "search_log_ref": { "type": "string", "minLength": 1 },
    "search_log_hash": { "type": "string" },
    "dialogue_table_ref": { "type": "string" },
    "neighbour_table_ref": { "type": "string" },
    "status": { "enum": ["DRAFTING", "FROZEN", "SUPERSEDED"] },
    "frozen_at": { "type": ["string", "null"] },
    "supersedes": { "type": ["string", "null"] },
    "citations": {
      "type": "array",
      "items": {
        "type": "object",
        "required": ["citation_card_id", "status", "identifier_kind", "fetch_status", "metadata_verified", "claim_match_verified", "claim_match_verification_route"],
        "properties": {
          "citation_card_id": { "type": "string" },
          "status": { "$ref": "common.defs.json#/definitions/citation_status" },
          "identifier_kind": { "$ref": "common.defs.json#/definitions/identifier_kind" },
          "fetch_status": { "$ref": "common.defs.json#/definitions/fetch_status" },
          "acquisition_log_ref": { "type": ["string", "null"] },
          "metadata_verified": { "type": "boolean" },
          "claim_match_verified": { "type": "boolean" },
          "claim_match_verification_route": { "enum": ["HUMAN_I5", "DECORRELATED_AI_I3", "NOT_YET"] },
          "version_status": { "enum": ["PREPRINT", "PUBLISHED", "BOTH_LINKED", "NOT_APPLICABLE"] },
          "retraction_check": { "enum": ["CLEAR", "RETRACTED", "UNCHECKED"] },
          "dialogue_table_stance": { "enum": ["agrees", "disagrees", "orthogonal", "undetermined"] },
          "intake_tier": {
            "enum": ["request_tier", "not_flagged"],
            "default": "not_flagged",
            "description": "rule22 (INTAKE-TIER-UNTIERED, FOUNDATION_v0.6_PATCH.md §4, thin scope per DECISIONS.md 2026-09-05): a source whose genre would normally suppress a full AACODS trace-to-original+appraise pass is flagged request_tier -- a request for a tier assignment, never a rejection. Distinct from a rejected citations[] row."
          },
          "intake_tier_reason": {
            "type": ["string", "null"],
            "description": "Non-empty when intake_tier=request_tier is a WARNING-only expectation (rule22 is thin, never blocks) -- an empty reason on a request_tier row is logged, not schema-rejected."
          },
          "global_south_exempt": {
            "type": "boolean",
            "default": false,
            "description": "Reserved, currently inert: no kernel code reads this flag yet. Intended future use: mark a Global South anecdotal/expert/local-knowledge evidence genre so a D-LIT-* suspicion framing is not applied to it -- the flag names a checklist gap, never a downgrade of the source's standing."
          },
          "diversity": {
            "type": "object",
            "properties": {
              "language": { "enum": ["en", "th", "other"] },
              "discipline_or_tradition": { "type": "string" },
              "source_type": { "enum": ["peer_reviewed", "preprint", "grey_literature", "practitioner", "community", "archival", "field_observation"] },
              "search_route_or_database": { "type": "string" },
              "geography_or_institution": { "type": "string" },
              "venue_quality_index": {
                "type": "object",
                "properties": {
                  "index_name": { "type": ["string", "null"] },
                  "value": { "type": ["string", "null"] },
                  "date_read": { "type": ["string", "null"] }
                }
              }
            }
          }
        }
      }
    },
    "strata_table": {
      "type": "array",
      "items": {
        "type": "object",
        "properties": {
          "stratum": {
            "type": "object",
            "properties": {
              "quality_tier": { "type": "string" }, "region": { "type": "string" },
              "language": { "type": "string" }, "source_type": { "type": "string" }
            }
          },
          "candidates_considered": { "type": "array", "items": { "type": "string" } },
          "selected": { "type": ["string", "null"] },
          "selection_reason": { "type": "string" }
        }
      }
    },
    "diversity_audit": {
      "type": "object",
      "required": ["counts", "concentration_flags", "zero_disagree_flag"],
      "properties": {
        "counts": {
          "type": "object",
          "properties": {
            "by_language": { "type": "object" },
            "by_source_type": { "type": "object" },
            "by_search_route_or_database": { "type": "object" },
            "by_stance": { "type": "object" },
            "by_geography_or_institution": { "type": "object" }
          }
        },
        "concentration_flags": { "type": "array" },
        "zero_disagree_flag": { "type": "boolean" },
        "never_claim_diverse_without_counts": { "const": true }
      }
    },
    "accuracy": {
      "type": "object",
      "required": ["total_citations", "verified_count", "spot_check"],
      "properties": {
        "total_citations": { "type": "integer" },
        "verified_count": { "type": "integer" },
        "spot_check": {
          "type": "object",
          "properties": {
            "applicable": { "type": "boolean" },
            "proposed_n_percent": { "type": "number" },
            "small_n_rule_applied": { "type": "boolean" },
            "sampled_citation_ids": { "type": "array", "items": { "type": "string" } },
            "sample_size": { "type": "integer" },
            "spot_check_result": { "enum": ["PASS", "FAIL", "PENDING"] },
            "spot_checked_by": { "type": ["string", "null"] },
            "spot_checked_at": { "type": ["string", "null"] }
          }
        }
      }
    },
    "secondary_citation_ban_audit": {
      "type": "object",
      "properties": { "violations_found": { "type": "integer", "minimum": 0 } }
    },
    "gate": {
      "type": "object",
      "required": ["accuracy_gate", "diversity_gate", "overall"],
      "properties": {
        "accuracy_gate": { "$ref": "common.defs.json#/definitions/gate_verdict" },
        "diversity_gate": { "$ref": "common.defs.json#/definitions/gate_verdict" },
        "overall": { "$ref": "common.defs.json#/definitions/gate_verdict" },
        "blocked_reason": { "type": ["string", "null"] }
      }
    },
    "disclaimers_emitted": { "type": "array", "items": { "$ref": "common.defs.json#/definitions/disclaimer_ref" } },
    "architecture_review": {
      "description": "Optional (S14 §3.5, design/ARCHITECTURE_FIRST_REVIEW_PROPOSAL_v0.2.md §8 R3, ratified 2026-09-23): populated only when this run used the architecture-first comparative review companion mode. Absent/empty on an ordinary single-claim L1-L6 run.",
      "type": "object",
      "properties": {
        "used": { "type": "boolean", "default": false },
        "architecture_map_ref": { "type": ["string", "null"] },
        "architecture_dialogue_table_ref": { "type": ["string", "null"] },
        "node_status": {
          "type": "array",
          "items": {
            "type": "object",
            "required": ["node_id", "status"],
            "properties": {
              "node_id": { "type": "string", "minLength": 1 },
              "status": { "enum": ["OPEN", "CLOSED"] },
              "reason": { "type": ["string", "null"] }
            }
          }
        },
        "n_open_nodes": { "type": "integer", "minimum": 0, "default": 0 }
      }
    },
    "human_owner": { "type": "string", "minLength": 1 }
  },
  "allOf": [
    {
      "description": "gate.overall FAIL requires blocked_reason non-null (template's own rule).",
      "if": { "properties": { "gate": { "type": "object", "properties": { "overall": { "const": "FAIL" } } } } },
      "then": { "properties": { "gate": { "type": "object", "required": ["blocked_reason"], "properties": { "blocked_reason": { "type": "string", "minLength": 1 } } } } }
    },
    {
      "description": "secondary_citation_ban_audit.violations_found > 0 is a hard block (never a warning) -- overall may not be PASS while violations exist.",
      "if": { "required": ["secondary_citation_ban_audit"], "properties": { "secondary_citation_ban_audit": { "type": "object", "properties": { "violations_found": { "type": "integer", "minimum": 1 } }, "required": ["violations_found"] } } },
      "then": { "properties": { "gate": { "type": "object", "properties": { "overall": { "enum": ["FAIL", "HUMAN_REVIEW"] } } } } }
    }
  ]
}
