{
  "id": "litrev-cat-litterbox-001",
  "hypothesis_ref": "GLOSA-CC-20260904-0001",
  "search_log_ref": "search-cat-litterbox-001",
  "search_log_hash": "sha256:0000000000000000000000000000000000000000000000000000000000synthetic",
  "dialogue_table_ref": "cases/worked-example-cat/dialogue_table.md",
  "neighbour_table_ref": "cases/worked-example-cat/neighbour_table.md",
  "status": "FROZEN",
  "frozen_at": "2026-09-06",
  "supersedes": null,
  "citations": [
    {
      "citation_card_id": "cite-cat-obs-001",
      "status": "VERIFIED",
      "identifier_kind": "BLACKBOX_NOTE",
      "fetch_status": "FETCHED",
      "acquisition_log_ref": null,
      "metadata_verified": true,
      "claim_match_verified": true,
      "claim_match_verification_route": "HUMAN_I5",
      "version_status": "NOT_APPLICABLE",
      "retraction_check": "CLEAR",
      "dialogue_table_stance": "agrees",
      "diversity": {
        "language": "th",
        "discipline_or_tradition": "household direct observation",
        "source_type": "field_observation",
        "search_route_or_database": "internal Blackbox Note",
        "geography_or_institution": "single household, Thailand",
        "venue_quality_index": { "index_name": null, "value": null, "date_read": null }
      }
    }
  ],
  "strata_table": [
    {
      "stratum": { "quality_tier": "field_observation", "region": "Thailand", "language": "th", "source_type": "field_observation" },
      "candidates_considered": ["cite-cat-obs-001"],
      "selected": "cite-cat-obs-001",
      "selection_reason": "only candidate in this stratum, directly verified"
    }
  ],
  "diversity_audit": {
    "counts": {
      "by_language": { "th": 1 },
      "by_source_type": { "field_observation": 1 },
      "by_search_route_or_database": { "internal Blackbox Note": 1 },
      "by_stance": { "agrees": 1, "disagrees": 0, "orthogonal": 0, "undetermined": 0 },
      "by_geography_or_institution": { "single household, Thailand": 1 }
    },
    "concentration_flags": ["100% of sources are the maker's own field observation -- single-source concentration, disclosed"],
    "zero_disagree_flag": true,
    "never_claim_diverse_without_counts": true
  },
  "accuracy": {
    "total_citations": 1,
    "verified_count": 1,
    "spot_check": {
      "applicable": false,
      "proposed_n_percent": 20,
      "small_n_rule_applied": true,
      "sampled_citation_ids": [],
      "sample_size": 0,
      "spot_check_result": "PASS",
      "spot_checked_by": "founder",
      "spot_checked_at": "2026-09-06"
    }
  },
  "secondary_citation_ban_audit": { "violations_found": 0 },
  "gate": { "accuracy_gate": "PASS", "diversity_gate": "PASS_WITH_LIMITS", "overall": "PASS_WITH_LIMITS", "blocked_reason": null },
  "disclaimers_emitted": [ { "id": "D-LIT-CONCENTRATED" } ],
  "human_owner": "founder"
}
